{
  "audience": {
    "detail": "The audience is an explicit hypothesis in this fixture and has not yet been validated against a real participant sample.",
    "evidence_refs": [],
    "status": "hypothesis"
  },
  "authority": {
    "human_review_required": true,
    "may_change_public_accounts": false,
    "may_publish": false
  },
  "brief": {
    "artifact_ref": "records/project-start/briefs/START-example-growth/r1.json",
    "artifact_revision": "r1",
    "artifact_sha256": "566ab1985bff42865240991551c77507607c2600b3fed30ae64a3eb954d1fa63"
  },
  "contains_personal_data": false,
  "evidence": {
    "detail": "No bounded evidence package has been assessed yet, so this fixture cannot support a recommendation.",
    "evidence_refs": [],
    "status": "not_started"
  },
  "first_recommendation": {
    "detail": "A recommendation will be prepared only after audience validation and sufficient bounded evidence.",
    "evidence_refs": [],
    "status": "not_started"
  },
  "project_id": "example-project",
  "project_profile_revision": "example-project-profile-v2",
  "readiness_version": "1.0",
  "recorded_at": "2026-08-31T17:05:00Z",
  "recorded_by": "growth-coordinator",
  "snapshot_id": "START-READY-example-baseline"
}
